{"closure":{"open_frontier_node_ids":[],"reason_codes":[],"state":"closed"},"evidence":[{"authority":"runtime-mechanics","evidence_id":"atlas-provenance-evidence:sha256:463287b9d79d79db11e21b83871a30bf5d1c770924c0a7f0ad8773aa5a20d695","record":{"physical_side":"DEDICATED_SERVER","profile":"COMMON_FINAL_STATE","runtime_kind":"recipe","runtime_node_id":"rg:common_final_state_dedicated_server:recipe:pilot_exact","runtime_record_sha256":"7777777777777777777777777777777777777777777777777777777777777777","snapshot_id":"SNAPSHOT-SUSY-0-1-16-11-9D3AA7AE0","state_sha256":"6666666666666666666666666666666666666666666666666666666666666666"},"record_kind":"final-runtime-record","record_sha256":"d2d42f24ffd4135efa6c33701d4232f898508f6ad7e288d5e9c21561a02a5da4"},{"authority":"pinned-source","evidence_id":"atlas-provenance-evidence:sha256:4e080ed00a5aa66c70b6f340d86cdf062703609f3a5e8fc4d489c5cc3ab7b70d","record":{"primitive_source_span_id":"atlas-source-span:sha256:112fe7e87bf067f1d948468a5d4b866055d0047bffb846dd7fdba5f608307d64","source_index_id":"atlas-source-span-index:sha256:4444444444444444444444444444444444444444444444444444444444444444","source_span":{"byte_end":37,"byte_start":20,"extraction_policy_id":"ATLAS-GROOVY-BALANCED-CALL-V1","file_sha256":"1111111111111111111111111111111111111111111111111111111111111111","line_end":1,"line_start":1,"path":"groovy/postInit/pilot.groovy","repository":"https://github.com/SymmetricDevs/Supersymmetry","revision":"9d3aa7ae0294bf27f0b8acbb893d61da23a06972","source_id":"SRC-PACK","source_lock_id":"supersymmetry-legacy-forge","span_sha256":"2222222222222222222222222222222222222222222222222222222222222222","symbol":"pilot#call:buildAndRegister@1:1","tree":"3f6101aac500bca8ba892a5a7d060a3b490ee11c"}},"record_kind":"source-span","record_sha256":"42f3d9902b2a90ef40dde0ff5dd3727a502f5a7541c053596861fc8bf355c29a"},{"authority":"runtime-mechanics","evidence_id":"atlas-provenance-evidence:sha256:f7d9c1f99550f5d5c9ec24c7ad453599e9274b335bf5baf77e1b5e432e418c74","record":{"object_node_id":"atlas-provenance-node:sha256:b739009bac0a258eaaad1a9704e088cfcfcee1ae811fe064e4418193fcb2911f","operation_id":"atlas-pack-operation:sha256:c18c4766901f1c17af9306ca27ec025147feab4b1472fbf6952a65f19e594cf5","operation_node_id":"atlas-provenance-node:sha256:c1bcd86ca0928529ac50404429a4520406b3ce62662c66630cbf701e0bca1970","physical_side":"DEDICATED_SERVER","predicate":"registers","profile":"COMMON_FINAL_STATE","snapshot_id":"SNAPSHOT-SUSY-0-1-16-11-9D3AA7AE0","stage_execution_id":"STAGE-EXEC-PILOT-0001","stage_id":"groovy-post-init","subject_node_id":"atlas-provenance-node:sha256:c1bcd86ca0928529ac50404429a4520406b3ce62662c66630cbf701e0bca1970"},"record_kind":"state-transition","record_sha256":"7f9b7b11bc61ab17220c922ad2ecae8226c45956e91c02cb9531171314ca3e3c"},{"authority":"runtime-mechanics","evidence_id":"atlas-provenance-evidence:sha256:fed96a6e7d0257120be7fea1f146ccd5372e3b90fa05390466e608097ec6d017","record":{"executed_identity_sha256":"373907f130187859ae62ab3e7bae1d33358582c4a6dbe9c58d33c7bf1dfe83b8","executed_node_class":"script-operation","occurrence_id":"OCC-GROOVY-POST-INIT-0001","operation_id":"atlas-pack-operation:sha256:c18c4766901f1c17af9306ca27ec025147feab4b1472fbf6952a65f19e594cf5","physical_side":"DEDICATED_SERVER","profile":"COMMON_FINAL_STATE","related_identity_sha256s":["112fe7e87bf067f1d948468a5d4b866055d0047bffb846dd7fdba5f608307d64","1c4c47451054abba5a828b8c4148817e5fab88bc68b0b440095dd36630c3bbfc","373907f130187859ae62ab3e7bae1d33358582c4a6dbe9c58d33c7bf1dfe83b8"],"snapshot_id":"SNAPSHOT-SUSY-0-1-16-11-9D3AA7AE0","stage_execution_id":"STAGE-EXEC-PILOT-0001","stage_id":"groovy-post-init"},"record_kind":"stage-execution","record_sha256":"6778a104600ded17629863a4c32d3f34270040b4580d85a3903122f552634674"}],"format":"susy-atlas-causal-provenance-result-v1","negative_statements":[],"nodes":[{"evidence_ids":["atlas-provenance-evidence:sha256:463287b9d79d79db11e21b83871a30bf5d1c770924c0a7f0ad8773aa5a20d695"],"identity":{"capture_evidence_id":"atlas-provenance-evidence:sha256:463287b9d79d79db11e21b83871a30bf5d1c770924c0a7f0ad8773aa5a20d695","runtime_kind":"recipe","runtime_node_id":"rg:common_final_state_dedicated_server:recipe:pilot_exact","runtime_record_sha256":"7777777777777777777777777777777777777777777777777777777777777777"},"node_class":"final-runtime-record","node_id":"atlas-provenance-node:sha256:37855b317146efb4f3045a5a2c05a3c0fcfd8d180100da3947e7021a7ebeb591","scope":{"physical_side":"DEDICATED_SERVER","profile":"COMMON_FINAL_STATE","snapshot_id":"SNAPSHOT-SUSY-0-1-16-11-9D3AA7AE0"}},{"evidence_ids":["atlas-provenance-evidence:sha256:463287b9d79d79db11e21b83871a30bf5d1c770924c0a7f0ad8773aa5a20d695"],"identity":{"capture_evidence_id":"atlas-provenance-evidence:sha256:463287b9d79d79db11e21b83871a30bf5d1c770924c0a7f0ad8773aa5a20d695","runtime_node_id":"rg:common_final_state_dedicated_server:recipe:pilot_exact","state_sha256":"6666666666666666666666666666666666666666666666666666666666666666"},"node_class":"runtime-state","node_id":"atlas-provenance-node:sha256:b739009bac0a258eaaad1a9704e088cfcfcee1ae811fe064e4418193fcb2911f","scope":{"physical_side":"DEDICATED_SERVER","profile":"COMMON_FINAL_STATE","snapshot_id":"SNAPSHOT-SUSY-0-1-16-11-9D3AA7AE0"}},{"evidence_ids":["atlas-provenance-evidence:sha256:fed96a6e7d0257120be7fea1f146ccd5372e3b90fa05390466e608097ec6d017"],"identity":{"operation_index":0,"operation_sha256":"32bf4d92a67ee1c79ffe2adf3696e7b6665e7aac69ca78717279e836936befef","source_span_id":"atlas-provenance-node:sha256:e93beacc537c9529b7595600e791b8f37e52dcfe8b174d085f515167f37e45ca","stage_execution_id":"STAGE-EXEC-PILOT-0001"},"node_class":"script-operation","node_id":"atlas-provenance-node:sha256:c1bcd86ca0928529ac50404429a4520406b3ce62662c66630cbf701e0bca1970","scope":{"physical_side":"DEDICATED_SERVER","profile":"COMMON_FINAL_STATE","snapshot_id":"SNAPSHOT-SUSY-0-1-16-11-9D3AA7AE0"}},{"evidence_ids":["atlas-provenance-evidence:sha256:4e080ed00a5aa66c70b6f340d86cdf062703609f3a5e8fc4d489c5cc3ab7b70d"],"identity":{"byte_end":37,"byte_start":20,"extraction_policy_id":"ATLAS-GROOVY-BALANCED-CALL-V1","file_sha256":"1111111111111111111111111111111111111111111111111111111111111111","line_end":1,"line_start":1,"path":"groovy/postInit/pilot.groovy","repository":"https://github.com/SymmetricDevs/Supersymmetry","revision":"9d3aa7ae0294bf27f0b8acbb893d61da23a06972","source_id":"SRC-PACK","source_lock_id":"supersymmetry-legacy-forge","span_sha256":"2222222222222222222222222222222222222222222222222222222222222222","symbol":"pilot#call:buildAndRegister@1:1","tree":"3f6101aac500bca8ba892a5a7d060a3b490ee11c"},"node_class":"source-span","node_id":"atlas-provenance-node:sha256:e93beacc537c9529b7595600e791b8f37e52dcfe8b174d085f515167f37e45ca","scope":{"physical_side":"DEDICATED_SERVER","profile":"COMMON_FINAL_STATE","snapshot_id":"SNAPSHOT-SUSY-0-1-16-11-9D3AA7AE0"}}],"pagination":{"continuation":null,"mode":"none-v1-single-bounded-result"},"paths":[{"closure_state":"closed","node_ids":["atlas-provenance-node:sha256:e93beacc537c9529b7595600e791b8f37e52dcfe8b174d085f515167f37e45ca","atlas-provenance-node:sha256:c1bcd86ca0928529ac50404429a4520406b3ce62662c66630cbf701e0bca1970","atlas-provenance-node:sha256:b739009bac0a258eaaad1a9704e088cfcfcee1ae811fe064e4418193fcb2911f","atlas-provenance-node:sha256:37855b317146efb4f3045a5a2c05a3c0fcfd8d180100da3947e7021a7ebeb591"],"open_reason_codes":[],"path_id":"atlas-provenance-path:sha256:0b0d76c90329441506d97e67284cdb59868011539a73c93f0c81da214007f20d","relation_ids":["atlas-provenance-relation:sha256:2a5e050875beef7e6e8d75a6a99a6dc0f32054f179f0b19b67dc8266ac94cdc7","atlas-provenance-relation:sha256:f17a979f3ab3243ed8a32fb0ca61757d90ba63d8ce5bfa3dd7f9c6e69c255919","atlas-provenance-relation:sha256:17c039a86ea4aeeb08f11c05f9b144599f21f9e3a0bc7fcba72d9868332935bd"]}],"relations":[{"causal_strength":"observation","evidence_ids":["atlas-provenance-evidence:sha256:463287b9d79d79db11e21b83871a30bf5d1c770924c0a7f0ad8773aa5a20d695"],"lifecycle_stage_id":"final-observation","object_node_id":"atlas-provenance-node:sha256:37855b317146efb4f3045a5a2c05a3c0fcfd8d180100da3947e7021a7ebeb591","predicate":"observed_as_final","relation_id":"atlas-provenance-relation:sha256:17c039a86ea4aeeb08f11c05f9b144599f21f9e3a0bc7fcba72d9868332935bd","subject_node_id":"atlas-provenance-node:sha256:b739009bac0a258eaaad1a9704e088cfcfcee1ae811fe064e4418193fcb2911f"},{"causal_strength":"causation","evidence_ids":["atlas-provenance-evidence:sha256:4e080ed00a5aa66c70b6f340d86cdf062703609f3a5e8fc4d489c5cc3ab7b70d","atlas-provenance-evidence:sha256:fed96a6e7d0257120be7fea1f146ccd5372e3b90fa05390466e608097ec6d017"],"lifecycle_stage_id":"groovy-post-init","object_node_id":"atlas-provenance-node:sha256:c1bcd86ca0928529ac50404429a4520406b3ce62662c66630cbf701e0bca1970","predicate":"invokes","relation_id":"atlas-provenance-relation:sha256:2a5e050875beef7e6e8d75a6a99a6dc0f32054f179f0b19b67dc8266ac94cdc7","subject_node_id":"atlas-provenance-node:sha256:e93beacc537c9529b7595600e791b8f37e52dcfe8b174d085f515167f37e45ca"},{"causal_strength":"causation","evidence_ids":["atlas-provenance-evidence:sha256:f7d9c1f99550f5d5c9ec24c7ad453599e9274b335bf5baf77e1b5e432e418c74","atlas-provenance-evidence:sha256:fed96a6e7d0257120be7fea1f146ccd5372e3b90fa05390466e608097ec6d017"],"lifecycle_stage_id":"groovy-post-init","object_node_id":"atlas-provenance-node:sha256:b739009bac0a258eaaad1a9704e088cfcfcee1ae811fe064e4418193fcb2911f","predicate":"registers","relation_id":"atlas-provenance-relation:sha256:f17a979f3ab3243ed8a32fb0ca61757d90ba63d8ce5bfa3dd7f9c6e69c255919","subject_node_id":"atlas-provenance-node:sha256:c1bcd86ca0928529ac50404429a4520406b3ce62662c66630cbf701e0bca1970"}],"request":{"bounds":{"max_evidence_records":16,"max_nodes":32,"max_paths":8,"max_relations":32},"final_runtime_record":{"capture_evidence_id":"atlas-provenance-evidence:sha256:463287b9d79d79db11e21b83871a30bf5d1c770924c0a7f0ad8773aa5a20d695","runtime